{
  "schemaVersion": 1,
  "role": "server",
  "connectionPolicy": "requireExtended",
  "limits": {
    "modelEntries": 4096,
    "soundEntries": 4096,
    "genericEntries": 8192,
    "eventEntries": 1024,
    "decalEntries": 1024,
    "resourceEntries": 16384,
    "consistencyEntries": 2048,
    "manifestBytes": 4194304,
    "chunkBytes": 16384,
    "inFlightBytes": 65536,
    "fileBytes": 16777215,
    "reliableMessageBytes": 65536
  },
  "storage": {
    "knownModelEntries": 8192,
    "localModelReserve": 64
  },
  "metadataBudgetBytes": 67108864,
  "negotiation": {
    "timeoutMs": 15000,
    "maxBytes": 4096
  },
  "applicationContractSha256": "db2254cb4b74fe68551509d621a9fb157bc8dc1dd42879db40af07519cd18fe5"
}
